{"$schema":"https://json-schema.org/draft/2020-12/schema","$id":"https://bestprintsco.com/schemas/catalog-job-artifact/v1.0.0","title":"BPC Job Recovery Artifact","type":"object","required":["schemaVersion","jobId","batch","kind","createdAtUtc","records"],"properties":{"schemaVersion":{"const":"1.0.0"},"jobId":{"type":"string","pattern":"^CAT-[A-Z0-9-]+$"},"batch":{"type":"integer","minimum":1},"kind":{"enum":["BEFORE","AFTER","ROLLBACK","CHANGELOG","PROTECTED_DIFF","VALIDATION"]},"createdAtUtc":{"type":"string","format":"date-time"},"cursorOwner":{"type":["string","null"]},"records":{"type":"array"}},"additionalProperties":false}
