{"schemaVersion":"1.0.0","jobId":"CAT-TEST","batch":1,"kind":"ROLLBACK","createdAtUtc":"2026-07-22T00:00:00Z","records":[{"id":"gid://shopify/Product/1","handle":"fixture","status":"ACTIVE","variants":[{"id":"gid://shopify/ProductVariant/2","sku":"FIX-1","price":"10.00"}],"options":[{"id":"gid://shopify/ProductOption/3","name":"Title","values":["Default Title"]}],"media":[],"collections":[],"publications":[],"inventory":[{"id":"gid://shopify/InventoryItem/4"}],"descriptionHtml":"old"}]}
